index,product_id,name,price,quantity,category,description,production_date,rating,status
121,122,Озеро Медвежье,6294,447,Напитки,Помогает улучшить работу мозга и повысить концентрацию внимания.,2014-01-05,2.08,New
122,123,Анапская,6077,344,Напитки,"Отличается низким содержанием жира, что делает его подходящим для тех, кто следит за фигурой.",2005-02-18,2.53,Awaiting Review
123,124,Айран,7415,201,Молочные продукты,"Отличается высоким содержанием калия, необходимого для нормальной работы сердца.",2006-02-06,2.52,Sold
124,125,Куриные крылышки,7778,258,Мясо,"Обладает приятным вкусом и мягкой текстурой, что делает его популярным выбором среди потребителей.",2013-02-10,4.09,Shipping
125,126,Абрикос,1818,827,Фрукты,"Отличается высоким содержанием кверцетина, флавоноида, обладающего антиоксидантными и противовоспалительными свойствами.",2005-07-12,2.6,Temporarily Unavailable
126,127,Одеяла,7339,321,Товары для дома,"Отличается низким содержанием натрия, что делает его безопасным для гипертоников.",1998-03-04,3.3,Available for Pickup
127,128,Чай зеленый,7204,219,Бакалея,"Отличается высоким содержанием хлорогеновых кислот, веществ, способствующих снижению веса и контролю уровня сахара в крови.",2007-11-03,0.87,Pending
129,130,Грейпфрут,7759,328,Фрукты,"Отличается высоким содержанием пробиотиков, улучшающих микрофлору кишечника.",1994-01-02,1.75,Out of Stock
130,131,Пакеты для пляжа,2518,872,Товары для дома,"Помогает поддерживать нормальный уровень даидзеина, изофлавона, полезного для здоровья женщин во время менопаузы.",1999-07-04,1.57,Available for Pickup
131,132,Шубат,2383,348,Молочные продукты,"Помогает поддерживать нормальный уровень нарингина, флавоноида, полезного для снижения уровня холестерина и улучшения пищеварения.",1998-01-01,2.91,Awaiting Review
132,133,Индюшатина,3589,409,Мясо,Помогает предотвратить развитие остеопороза благодаря высокому содержанию кальция.,2003-05-15,3.83,Pending
133,134,Каша из манной крупы,7284,286,Бакалея,Способствует нормализации обмена веществ в организме.,2019-01-07,2.33,Cancelled
134,135,Дыня,1620,428,Фрукты,"Обладает приятными органолептическими свойствами, привлекающими внимание покупателей.",2018-11-12,4.75,Backorder
135,136,Цветная капуста,577,24,Овощи,"Отличается длительным сроком годности, что позволяет делать запасы.",2016-01-05,4.35,Available for Pickup
136,137,Aquafina,9498,417,Напитки,"Помогает поддерживать нормальный уровень глюкагона, гормона, регулирующего уровень глюкозы в крови.",2001-02-02,1.34,Shipping
137,138,Шпинат,148,302,Овощи,Подходит для использования в рецептах традиционной кухни разных стран.,2012-01-01,4.49,Pending
138,139,Сметана,6581,19,Молочные продукты,Помогает укрепить иммунную систему и защитить организм от инфекций.,2004-03-02,4.73,Sold
139,140,Мытищинская,7561,348,Напитки,"Является источником важных микроэлементов, таких как магний и калий.",2009-08-03,1.0,Shipping
140,141,Чебуреки,8853,805,Мясо,"Отличается высоким содержанием карнитина, необходимого для преобразования жиров в энергию.",1994-01-01,2.89,Pending
141,142,Турнепс,4283,861,Овощи,"Отличается высоким содержанием антиоксидантов, защищающих клетки от окислительного стресса.",1991-04-03,2.83,Sold
142,143,Фейхоа,5484,92,Фрукты,Служит основой для создания множества кулинарных шедевров.,1994-06-06,0.83,Refunded
143,144,Масло сливочное,6823,687,Молочные продукты,Широко используется в традиционной и современной кухне.,2007-01-01,4.02,Sold
144,145,Уральская,5730,175,Напитки,"Отличается высоким содержанием пиридоксина, необходимого для синтеза нейромедиаторов.",2011-01-26,2.44,Backorder
145,146,Катык,3954,472,Молочные продукты,Помогает улучшать качество сна и снижать уровень тревожности.,1993-02-18,0.53,Returned
146,147,Черешня,4551,894,Фрукты,"Отличается высоким содержанием ресвератрола, вещества, обладающего антивозрастными свойствами.",1993-07-18,1.25,Refunded
147,148,Сок морковный,898,787,Напитки,Помогает поддерживать здоровье глаз и зрение благодаря содержанию витамина A.,1993-02-08,0.12,Out of Stock
148,149,Клюква,6932,554,Фрукты,"Отличается высоким содержанием таурина, необходимого для здоровья глаз и сердца.",2014-04-12,2.0,Shipping
149,150,Конина,1320,359,Мясо,"Помогает поддерживать нормальный уровень нарингина, флавоноида, полезного для снижения уровня холестерина и улучшения пищеварения.",2005-09-07,3.33,Out of Stock
150,151,Новый свет,3882,874,Напитки,"Отличается устойчивостью к температурным изменениям, что облегчает хранение.",2019-01-15,3.98,Out of Stock
151,152,Мацони,5697,511,Молочные продукты,"Отличается высоким содержанием хлорогеновых кислот, веществ, способствующих снижению веса и контролю уровня сахара в крови.",2013-02-13,2.41,Temporarily Unavailable
152,153,Айва,3346,306,Фрукты,"Отличается высоким содержанием пикногенола, мощного антиоксиданта, полезного для кожи и сосудов.",1990-01-12,2.4,Sold
153,154,Пакеты для садовых работ,5316,41,Товары для дома,Помогает поддерживать нормальный уровень эстрогенов у женщин.,1996-07-09,0.64,Cancelled
154,155,Пакеты для документов,4244,121,Товары для дома,Отличается высокой питательностью и способен быстро утолить голод.,1994-05-02,1.02,Temporarily Unavailable
155,156,Мята перечная сушеная,8845,557,Бакалея,Помогает поддерживать здоровый цвет лица и упругость кожи.,2021-09-01,1.96,Awaiting Review
156,157,Сушеные грибы,566,936,Бакалея,Отличается простотой в использовании и хранении.,2010-02-02,5.0,Awaiting Review
158,159,Хабаровская,2752,630,Напитки,Является важным компонентом сбалансированного рациона питания.,1994-09-23,3.39,Cancelled
159,160,Павловская,8479,606,Напитки,Может использоваться в косметических процедурах для увлажнения кожи.,2021-05-04,2.82,Awaiting Review
160,161,Пакеты для Всемирного дня музыки,6812,692,Товары для дома,Прошел все необходимые сертификации и соответствует международным стандартам.,2011-02-07,3.2,On Backorder
161,162,Азовская,4318,242,Напитки,Отличается высокой питательностью и способен быстро утолить голод.,1997-04-14,0.43,Pending
162,163,Кефир,8023,831,Молочные продукты,Способствует поддержанию нормальной микрофлоры кишечника.,2016-01-01,0.77,Pending
163,164,Каймак,4833,790,Молочные продукты,"Отличается высоким содержанием витамина K, необходимого для свертывания крови и здоровья костей.",2016-01-18,0.5,Refunded
164,165,Щавель,3413,696,Овощи,"Помогает поддерживать нормальный уровень нарингина, флавоноида, полезного для снижения уровня холестерина и улучшения пищеварения.",2019-02-14,4.54,Returned
165,166,Гауда,3268,525,Молочные продукты,Широко используется в традиционной и современной кухне.,1992-11-02,4.5,New
166,167,Косулятина,4715,947,Мясо,"Отличается высоким содержанием хрома, необходимого для регуляции уровня сахара в крови.",2004-04-23,1.29,Shipping
167,168,Черный перец горошком,5811,873,Бакалея,"Отличается высоким содержанием DMAE, вещества, улучшающего умственную деятельность и настроение.",2004-02-09,2.44,Sold
168,169,Мороженое,1626,341,Молочные продукты,"Подходит для людей всех возрастов, включая детей и пожилых.",1993-02-05,3.82,Sold
169,170,Сыр,7146,326,Молочные продукты,Способствует нормализации обмена веществ в организме.,2016-03-02,4.2,Out of Stock
170,171,Томатная паста,7276,98,Бакалея,"Является источником витаминов группы B, необходимых для энергетического обмена.",2013-07-04,2.1,Refunded
171,172,Морковь,6908,458,Овощи,Помогает поддерживать нормальный уровень сахара в крови.,2003-04-09,2.18,Sold
172,173,Клюква,7498,369,Фрукты,"Является источником антиоксидантов, замедляющих процессы старения.",1995-02-04,0.32,Available for Pickup
173,174,Пакеты для дня рождения,3621,480,Товары для дома,Отличается натуральным составом и отсутствием искусственных добавок.,2012-02-20,0.28,Out of Stock
174,175,Читинская,9094,915,Напитки,"Отличается высоким содержанием тиамина, необходимого для нормального функционирования нервной системы.",2016-03-01,1.51,Sold
175,176,Топлёное молоко,872,209,Молочные продукты,"Отличается высоким содержанием таурина, необходимого для здоровья глаз и сердца.",2013-02-14,0.01,New
176,177,Пиво безалкогольное,7005,719,Напитки,"Отличается высоким содержанием инозитола, необходимого для здоровья нервной системы.",2020-09-11,2.3,Backorder
177,178,Вымя,1727,890,Мясо,"Отличается высоким содержанием холина, необходимого для здоровья мозга и памяти.",1994-10-17,4.44,Refunded
178,179,Инжир,6390,889,Фрукты,"Помогает поддерживать нормальный уровень куркумина, вещества, обладающего противовоспалительными и антиоксидантными свойствами.",2002-01-05,3.51,On Backorder
179,180,Камут,5162,630,Бакалея,"Отличается высоким содержанием пребиотиков, способствующих здоровью кишечника.",2000-07-02,4.06,Delivered
180,181,Черешня,4012,242,Фрукты,"Отличается высоким содержанием ликопина, каротиноида, полезного для здоровья простаты и кожи.",2001-02-01,1.28,Backorder
181,182,Чеддер,1723,349,Молочные продукты,"Помогает поддерживать нормальный уровень дофамина, гормона, отвечающего за мотивацию и удовольствие.",1990-01-09,3.99,In Stock
182,183,Кокос,8034,580,Фрукты,"Отличается высоким содержанием холина, необходимого для здоровья мозга и памяти.",2015-01-06,2.22,Cancelled
